{
  "$schema": "scalar_db_table_schema.json",
  "table_name": "benefit",
  "partition_keys": [
    {
      "name": "company_id",
      "type": "text"
    }
  ],
  "clustering_keys": [
    {
      "name": "created_at",
      "type": "bigint"
    },
    {
      "name": "organization_id",
      "type": "text"
    }
  ],
  "columns": [
    {
      "name": "category_of_benefit",
      "type": "text"
    },
    {
      "name": "benefit_name",
      "type": "text"
    },
    {
      "name": "description",
      "type": "text"
    },
    {
      "name": "provider",
      "type": "text"
    },
    {
      "name": "time_of_provision",
      "type": "text"
    },
    {
      "name": "updated_at",
      "type": "bigint"
    }
  ]
}
