{
  "$schema": "scalar_db_table_schema.json",
  "table_name": "data_set_schema",
  "partition_keys": [
    {
      "name": "company_id",
      "type": "text"
    }
  ],
  "clustering_keys": [
    {
      "name": "created_at",
      "type": "bigint"
    },
    {
      "name": "organization_id",
      "type": "text"
    }
  ],
  "columns": [
    {
      "name": "data_set_name",
      "type": "text"
    },
    {
      "name": "description",
      "type": "text"
    },
    {
      "name": "data_location",
      "type": "text"
    },
    {
      "name": "category_of_data",
      "type": "text"
    },
    {
      "name": "data_type",
      "type": "text"
    },
    {
      "name": "classification",
      "type": "text"
    },
    {
      "name": "data_set_schema",
      "type": "text"
    },
    {
      "name": "is_active",
      "type": "boolean"
    },
    {
      "name": "created_by",
      "type": "text"
    },
    {
      "name": "updated_at",
      "type": "bigint"
    }
  ]
}
