{
  "$schema": "scalar_db_table_schema.json",
  "table_name": "purpose",
  "partition_keys": [
    {
      "name": "company_id",
      "type": "text"
    }
  ],
  "clustering_keys": [
    {
      "name": "created_at",
      "type": "bigint"
    },
    {
      "name": "organization_id",
      "type": "text"
    }
  ],
  "columns": [
    {
      "name": "category_of_purpose",
      "type": "text"
    },
    {
      "name": "purpose_name",
      "type": "text"
    },
    {
      "name": "description",
      "type": "text"
    },
    {
      "name": "legal_text",
      "type": "text"
    },
    {
      "name": "user_friendly_text",
      "type": "text"
    },
    {
      "name": "guidance",
      "type": "text"
    },
    {
      "name": "note",
      "type": "text"
    },
    {
      "name": "is_active",
      "type": "boolean"
    },
    {
      "name": "created_by",
      "type": "text"
    },
    {
      "name": "updated_at",
      "type": "bigint"
    }
  ]
}
