{
  "$schema": "scalar_db_table_schema.json",
  "table_name": "data_retention_policy",
  "partition_keys": [
    {
      "name": "company_id",
      "type": "text"
    }
  ],
  "clustering_keys": [
    {
      "name": "created_at",
      "type": "bigint"
    },
    {
      "name": "policy_type",
      "type": "text"
    },
    {
      "name": "organization_id",
      "type": "text"
    }
  ],
  "columns": [
    {
      "name": "policy_name",
      "type": "text"
    },
    {
      "name": "length_of_use",
      "type": "text"
    },
    {
      "name": "length_of_retention",
      "type": "text"
    },
    {
      "name": "description",
      "type": "text"
    },
    {
      "name": "is_active",
      "type": "boolean"
    },
    {
      "name": "updated_at",
      "type": "bigint"
    }
  ]
}
